{
  "$schema": "../../schemas/generate.schema.json",
  "seed": 385653283,
  "flowerSeed": 3856532837,
  "outputDir": "./output_images",
  "waveFreqExpr": "8 - 6*x",
  "waveCount": 16,
  "waveStartDegree": 265,
  "waveDistance": -135,
  "waveColorLoopCount": 1,
  "waveLightness": 0.2375,
  "waveChroma": 0.075,
  "waveAmplitude": 10,
  "shadowDarkness": 1,
  "waveEffect": "smear-down",
  "waveEffectStrength": 4,
  "lobeCount": 8,
  "lobeBumpiness": [
    0.003,
    0.00311,
    0.00344,
    0.00398,
    0.00475,
    0.00573,
    0.00694,
    0.00836,
    0.01
  ],
  "lobeGapRatio": 0.11,
  "lobeGapExponent": 1.3,
  "flowerSize": 0.28125,
  "flowerOpacity": 1,
  "flowerLightness": 0.4,
  "flowerChroma": 0.0425,
  "flowerLayerBlur": 0.6667,
  "flowerTurbulenceFreq": [
    0.04,
    0.0407,
    0.0426,
    0.0455,
    0.0494,
    0.0539,
    0.059,
    0.0644,
    0.07
  ],
  "flowerTurbulenceScale": [
    2,
    2.574,
    3.061,
    3.386,
    3.5,
    3.386,
    3.061,
    2.574,
    2
  ],
  "flowerTurbulenceOctaves": 1,
  "flowerTurbulenceType": "fractalNoise",
  "flowerOuterGlow": 0.15,
  "flowerOuterGlowColor": "oklch(0.9452 0.0779 115.19)",
  "flowerOuterGlowOpacity": 0.15,
  "flowerOuterGlowTwinkle": 0.25,
  "flowerOuterGlowTwinkleColor": "oklch(0.9452 0.0779 171)",
  "flowerOuterGlowTwinkleOpacity": 0.2,
  "flowerInnerGlow": 0.0625,
  "flowerInnerGlowColor": "oklch(0.9452 0.0779 115.19)",
  "flowerInnerGlowOpacity": 0.1,
  "flowerInnerGlowTwinkle": 0.1,
  "flowerInnerGlowTwinkleColor": "oklch(0.9452 0.0779 171)",
  "flowerInnerGlowTwinkleOpacity": 0.15,
  "outerPolygonEdges": 16,
  "outerPolygonRadius": 196,
  "polygonRingStep": 26.25,
  "polygonNodeRadius": 2,
  "polygonNodeGlow": 3,
  "polygonNodeFade": 0.5,
  "polygonNodeTwinkle": 15,
  "polygonNodeTwinkleRadius": 4,
  "polygonNodeTwinkleGlow": 6,
  "polygonNodeTwinkleFade": 2,
  "twinkleStrength": 0,
  "text": "/^merely\npresent/",
  "textSize": 65,
  "textLineHeight": 2,
  "textGlowDistance": 4,
  "textGlowStrength": 1,
  "textBackingSpread": 3,
  "textBackingDilate": 3,
  "textBackingOpacity": 1,
  "textFont": "Kode Mono",
  "textOffsetX": 0,
  "textOffsetY": 0.01,
  "flowerColors": [
    "oklch(0.66 0.105 322.40)",
    "oklch(0.62 0.189 328.59)",
    "oklch(0.59 0.224 335.72)",
    "oklch(0.50 0.252 343.83)",
    "oklch(0.41 0.252 344.98)",
    "oklch(0.34 0.231 345.95)",
    "oklch(0.31 0.210 346.75)",
    "oklch(0.26 0.105 347.25)",
    "oklch(0.22 0.054 348.00)"
  ],
  "polygonRingColors": [
    "oklch(0.7319 0.10 176.08 / 0.15)",
    "oklch(0.9 0.155 171    / 0.80)",
    "oklch(0.7319 0.10 163  / 0.15)",
    "oklch(0.9 0.155 157    / 0.80)",
    "oklch(0.7319 0.10 150  / 0.15)",
    "oklch(0.9 0.155 143    / 0.80)",
    "oklch(0.7319 0.10 136  / 0.15)",
    "oklch(0.9 0.155 129    / 0.80)",
    "oklch(0.7319 0.10 122  / 0.15)",
    "oklch(0.9 0.155 115.19 / 0.80)",
    "oklch(0.7319 0.10 110  / 0.2)"
  ]
}
