{
  "$schema": "../../schemas/generate.schema.json",
  "waveFreqExpr": "8 - 6*x",
  "waveCount": 16,
  "waveStartDegree": 0,
  "waveDistance": 360,
  "waveColorLoopCount": 1,
  "waveLightness": 0.7261,
  "waveChroma": 0.18,
  "waveAmplitude": 15,
  "shadowDarkness": 0.8,
  "waveEffect": "smear-down",
  "waveEffectStrength": 4,
  "lobeCount": 7,
  "lobeBumpiness": 0.075,
  "lobeGapRatio": 0.09,
  "lobeGapExponent": 1,
  "flowerSize": 0.15,
  "flowerOpacity": 1,
  "flowerLightness": 0.57,
  "flowerChroma": 0.1,
  "flowerLayerBlur": 1,
  "flowerTurbulenceFreq": 0.02,
  "flowerTurbulenceScale": 10,
  "flowerTurbulenceOctaves": 1,
  "flowerTurbulenceType": "fractalNoise",
  "flowerOuterGlow": 0.05,
  "flowerOuterGlowColor": "oklch(0.85 0.155 171 / 0.5)",
  "flowerOuterGlowOpacity": 0.25,
  "flowerOuterGlowTwinkle": 0.15,
  "flowerOuterGlowTwinkleColor": "oklch(0.9 0.19 115.19)",
  "flowerOuterGlowTwinkleOpacity": 0.25,
  "flowerInnerGlow": 0.05,
  "flowerInnerGlowColor": "oklch(0.85 0.155 171 / 0.5)",
  "flowerInnerGlowOpacity": 0.25,
  "flowerInnerGlowTwinkle": 0.15,
  "flowerInnerGlowTwinkleColor": "oklch(0.9 0.19 115.19)",
  "flowerInnerGlowTwinkleOpacity": 0.25,
  "outerPolygonEdges": 12,
  "outerPolygonRadius": 190,
  "polygonRingStep": 22,
  "polygonNodeRadius": 2,
  "polygonNodeGlow": 4,
  "polygonNodeFade": 1,
  "polygonNodeTwinkle": 10,
  "polygonNodeTwinkleRadius": 3,
  "polygonNodeTwinkleGlow": 6,
  "polygonNodeTwinkleFade": 2,
  "twinkleStrength": 1,
  "text": "/^merely\npresent/",
  "textSize": 40,
  "textLineHeight": 1,
  "textGlowDistance": 4,
  "textGlowStrength": 1,
  "textBackingSpread": 5,
  "textBackingDilate": 3,
  "textBackingOpacity": 0.9,
  "textFont": "DejaVu Sans Mono",
  "textOffsetX": 0,
  "textOffsetY": 0
}
